"","concept_name","concept_id","person_id_count"
"1","Metastatic carcinoid tumor",45767695,2844
"2","Leukemic reticuloendotheliosis of lymph nodes of head, face and neck",132570,26
"3","Secondary malignant neoplasm of cerebral meninges",4312290,176
"4","Secondary malignant neoplasm of large intestine",200348,1355
"5","Secondary malignant neoplasm of small intestine",198371,1226
"6","Secondary malignant neoplasm of liver",198700,24600
"7","Disseminated malignancy of unknown primary",438701,2826
"8","Distant metastasis present",4163446,318958
